{
  "event_id": "20260220_112558_gmail_259858",
  "source": "gmail",
  "type": "new_email",
  "timestamp": "2026-02-20T11:25:57.736865Z",
  "priority": "medium",
  "content": {
    "subject": "Security alert",
    "body": "[image: Google]\r\nRecovery phone was changed\r\n\r\n\r\nkashafamaan303@gmail.com\r\nThe recovery phone for your account was changed. If you didn't change it,\r\nyou should check what happened.\r\nCheck activity\r\n<https://accounts.google.com/AccountChooser?Email=kashafamaan303@gmail.com&continue=https://myaccount.google.com/alert/nt/1771461814049?rfn%3D4%26rfnc%3D1%26eid%3D-921738746997804348%26et%3D0>\r\nYou can also see security activity at\r\nhttps://myaccount.google.com/notifications\r\nYou received this email to let you know about important changes to your\r\nGoogle Account and services.\r\nÂ© 2026 Google LLC, 1600 Amphitheatre Parkway, Mountain View, CA 94043, USA\r\n",
    "from": "Google <no-reply@accounts.google.com>",
    "to": "kashafamaan303@gmail.com",
    "attachments": []
  },
  "metadata": {
    "thread_id": "19c735a2f09defad",
    "labels": [
      "UNREAD",
      "CATEGORY_UPDATES",
      "INBOX"
    ],
    "is_reply": false,
    "contact_history": "new",
    "raw_data": {
      "message_id": "19c735a2f09defad",
      "snippet": "Recovery phone was changed kashafamaan303@gmail.com The recovery phone for your account was changed. If you didn&#39;t change it, you should check what happened. Check activity You can also see"
    }
  },
  "created_at": "2026-02-20T11:25:58.999018Z",
  "processed": false
}