{
  "event_id": "20260220_113115_gmail_3e1ff9",
  "source": "gmail",
  "type": "new_email",
  "timestamp": "2026-02-20T11:31:15.311661Z",
  "priority": "medium",
  "content": {
    "subject": "✅ Finish setting up your new Google Account on your Infinix HOT Play",
    "body": "Hi,\r\n\r\nA better Android experience is waiting\r\n\r\nTake one minute to set up your Infinix HOT Play with Google\r\n\r\nGet  \r\nstarted<https://c.gle/AEJ26qsg616UkzZ_Ou4IP_ZQghEoAjg4DGd-ygQxOIx0dLgNPK62tUQXuNBYfs4KGstDxPDSJGgXBpdv6Y4SLMgNEOKG4Zsps07hGamQ9o-Q4kKTVU7VPM7A7DhAse4KoJ9LUlZ35MgXt6yapBleLxkA3r1Yejs7p3YE5M4bGrhNFTjGC-X_NXEsC9LSZ7OvmBrbnkSkZEs00DlKNylu57FQ0dLO_6eZdOHNSMquJg8O8C-0xmzj9BspYkCI2vkNdb7U6IL2KPBTY-l0ZyMTpcwTD_JH2A-VZJqOAMeKf11DoVZIHu7CDOGp0O4BnPtwfzSuiJhWdINw-3yq5-8NSz8kgF28ft9T1dOx-eWhFlziFLLe6773uAR4PrJS7ujKq_POyh1Jlkk_Uap32mZPnNfaoR7R-SPaimmNn9zmNQQVg6J80NmD_lF3a1O7EzbVOEEJP05f4DfdRw42BG-AO9uH1ixyH7x1nPRQ8T9vjzUmgdIUyw2MRzlRXsgiAmCgAgOvHhyFFfyuN3ptvSUn5ZhxkNEsvpLgju2z601X_TocpSeNuDl6Jv36agywVHJANV6VeiYeZTrrAW79pFl60qE95If5ExMn2fNLthRkKbxPES3mOHDKaSKRNaHhQRNkASvzAjBZk9ljZd6_DgBmLA>\r\n\r\nThis email was sent to kashafamaan303@gmail.com<kashafamaan303@gmail.com>  \r\nbecause you created a Google Account on your Infinix HOT Play device. If  \r\nyou do not wish to receive emails to help you set up your device with  \r\nGoogle when you sign into your account on the device for the first time,  \r\nplease  \r\nunsubscribe<https://c.gle/AEJ26qvHaERGJZxNdest8KJ_trUjBgiUo5MH9jS_8p2bc_I56DIXvg6u_4gk0VhMQoORf1UtnydQN1OjqZT6Enmeo9Ki-BaYq-HlBFxdlRsFzqgeKwHm45m7t0wLCUJdOlUUBdFXICTFiD4cKaWt9D31uWClf_xsBqF-4jx5t1lBkfbuBqZllz2t0Ii0k5q5wghxSfK7xzltEc1HlJMjVEpnVQAqNuZZKWFajRjpN41M0tauoblESwjvlrn4J53skHlaQzdISsWjgZbCpNDrjQkLY9l5n5QD_6M_akifTVhhAe0O0GKKTOSsnRgH6WWw4xvHtyHIC5Qm1ZM8l6aFgG2j8X-yzaXwOpGIui_d7s8TleeWs_SDlvBHiB6VkNM8uZfBr4IitxwVNeJjajEtWwMCz0hZ_HGaFtDJrSxNdgCxHiRkgfOEfjrTH8dHTd0Nqs8kB477haGHMJNt7FyzLO9ozIS7bqrOSAH_Db40jOPYHCea9GBk16-Dy0Gk_PVC9yWeUTsTk8QIoXf91ctzQZbt3HVjVSiCPT05R-lycvrYIN1GWLuyHbNCgj-ZxjhECVgf-YeY>.\r\n© 2026 Google LLC 1600 Amphitheatre Parkway, Mountain View, CA 94043\r\n",
    "from": "Google <no-reply@google.com>",
    "to": "kashafamaan303@gmail.com",
    "attachments": []
  },
  "metadata": {
    "thread_id": "19c730389c4c3c64",
    "labels": [
      "UNREAD",
      "CATEGORY_UPDATES",
      "INBOX"
    ],
    "is_reply": false,
    "contact_history": "new",
    "raw_data": {
      "message_id": "19c730389c4c3c64",
      "snippet": "Finish setting up your device with Google ‌ ‌ ‌ ‌ ‌ ‌ ‌ ‌ ‌ ‌ ‌ ‌ ‌ ‌ ‌ ‌ ‌ ‌ ‌ ‌ ‌ ‌ ‌ ‌ ‌ ‌ ‌ ‌ ‌ ‌ ‌ ‌ ‌ ‌ ‌ ‌ ‌ ‌ ‌ ‌ ‌ ‌ ‌ ‌ ‌ ‌ ‌ ‌ ‌ ‌ ‌ ‌ ‌ ‌ ‌ ‌ ‌ ‌ ‌ ‌ ‌ ‌ ‌ ‌ ‌ ‌ ‌ ‌ ‌ ‌ ‌ ‌ ‌ ‌ ‌ ‌ ‌ ‌ ‌ ‌"
    }
  },
  "created_at": "2026-02-20T11:31:15.611630Z",
  "processed": false
}